{
  "$schema": "https://json-schema.org/draft/2020-12/schema",
  "$id": "registry.v1.json",
  "$comment": "V0-seed schema — coarse definition sufficient for hand-written registry.json validation. V1 will refine constraints, add pattern rules, and tighten enum values once the generator and CLI stabilize.",
  "title": "Mifune Skills Registry",
  "description": "Schema for the mifunedev/skills registry.json canonical skill index.",
  "type": "object",
  "required": ["$schema", "name", "description", "version", "owner", "skills"],
  "additionalProperties": true,
  "properties": {
    "_v0_note": {
      "type": "string",
      "description": "Optional human note explaining V0 hand-written status. Present only in pre-generator releases."
    },
    "$schema": {
      "type": "string",
      "description": "Path or URL to this schema."
    },
    "name": {
      "type": "string",
      "description": "Registry package name. Lowercase + hyphens.",
      "pattern": "^[a-z0-9-]+$"
    },
    "description": {
      "type": "string",
      "description": "Human-readable description of the registry bundle."
    },
    "version": {
      "type": "string",
      "description": "CalVer version of the registry bundle (YYYY.M.D or YYYY.M.D-N).",
      "pattern": "^\\d{4}\\.\\d{1,2}\\.\\d{1,2}(-\\d+)?$"
    },
    "owner": {
      "type": "object",
      "required": ["name", "url"],
      "properties": {
        "name": { "type": "string" },
        "url": { "type": "string", "format": "uri" }
      }
    },
    "skills": {
      "type": "array",
      "minItems": 1,
      "items": {
        "type": "object",
        "required": [
          "name",
          "path",
          "version",
          "checksum",
          "description",
          "category",
          "requires-tools",
          "clients",
          "license",
          "added",
          "updated"
        ],
        "additionalProperties": true,
        "properties": {
          "name": {
            "type": "string",
            "description": "Skill name. Matches the folder name. Lowercase + hyphens.",
            "pattern": "^[a-z0-9-]+$",
            "maxLength": 64
          },
          "path": {
            "type": "string",
            "description": "Relative path from the repo root to the skill folder."
          },
          "version": {
            "type": "string",
            "description": "SemVer version of the individual skill.",
            "pattern": "^\\d+\\.\\d+\\.\\d+$"
          },
          "checksum": {
            "type": "string",
            "description": "sha256: prefixed hash of the skill folder contents. See docs/checksum.md.",
            "pattern": "^sha256:[0-9a-f]{64}$"
          },
          "description": {
            "type": "string",
            "description": "What the skill does and when to invoke it.",
            "maxLength": 1024
          },
          "category": {
            "type": "string",
            "description": "Browsing category on skills.mifune.dev.",
            "enum": [
              "open-harness",
              "dev-workflow",
              "code-review",
              "cloud-ops",
              "docs",
              "experimental"
            ]
          },
          "requires-tools": {
            "type": "array",
            "items": { "type": "string" },
            "description": "Binary names the skill expects on PATH."
          },
          "clients": {
            "type": "array",
            "items": { "type": "string" },
            "description": "Agent clients this skill has been tested against. Empty means any Agent-Skills-compliant client."
          },
          "license": {
            "type": "string",
            "description": "SPDX license identifier.",
            "examples": ["Apache-2.0", "MIT"]
          },
          "added": {
            "type": "string",
            "description": "ISO 8601 date the skill was first added to the registry.",
            "pattern": "^\\d{4}-\\d{2}-\\d{2}$"
          },
          "updated": {
            "type": "string",
            "description": "ISO 8601 date the skill entry was last updated.",
            "pattern": "^\\d{4}-\\d{2}-\\d{2}$"
          },
          "removed": {
            "type": "boolean",
            "description": "If true, skill is tombstoned and will be deleted after one CalVer cycle."
          }
        }
      }
    }
  }
}
